{
  "schema_version": "1.0",
  "skill_id": "bid-scoring",
  "project_id": "SIM-WB-20261011",
  "artifact_id": "ART-04-SCORING",
  "revision": 1,
  "created_at": "2026-10-10T23:15:21.925232+00:00",
  "status": "needs_review",
  "inputs": [
    {
      "artifact_id": "ART-01-NATIVE",
      "revision": 1,
      "relative_path": "artifacts/01-source-intake.json",
      "sha256": "e54a67dd19063b1f9e1345fa55cad3525f62891b1fc03b5645dc644b7852f464"
    },
    {
      "artifact_id": "ART-02-TENDER-ROUTING",
      "revision": 1,
      "relative_path": "artifacts/02-tender-routing.json",
      "sha256": "43009f353aa6b48ab2b7b9f5c59a5fe95257e82d2c09310f65dcba066adada67"
    }
  ],
  "summary": "按原文还原 1 个总分节点、4 个汇总节点与 9 个计分叶子；加和关系自洽（100 分），实际得分待报价与材料核验。",
  "data": {
    "declared_total": 100,
    "items": [
      {
        "id": "S-TOTAL",
        "parent_id": null,
        "title": "评分总分",
        "max_score": 100,
        "node_type": "rollup",
        "aggregation": "sum",
        "rule_text": "总分100分，由 S1-S5 加和构成。",
        "evidence_requirements": [],
        "sources": [
          {
            "source_id": "SRC-001",
            "revision": 1,
            "sha256": "06e94c48e988157848908ff2e209df8f74a0b38c52cc60fd0331eaa3ff1018b8",
            "location": "body[12]/paragraph",
            "quote": "三、评分标准（总分100分）",
            "kind": "tender"
          }
        ]
      },
      {
        "id": "S1",
        "parent_id": "S-TOTAL",
        "title": "价格分",
        "max_score": 30,
        "node_type": "scored",
        "aggregation": "none",
        "rule_text": "满足条件的最低报价/本供应商报价×30。",
        "evidence_requirements": [
          "本供应商报价"
        ],
        "sources": [
          {
            "source_id": "SRC-001",
            "revision": 1,
            "sha256": "06e94c48e988157848908ff2e209df8f74a0b38c52cc60fd0331eaa3ff1018b8",
            "location": "body[13]/paragraph",
            "quote": "S1价格30分：满足条件的最低报价/本供应商报价×30",
            "kind": "tender"
          }
        ]
      },
      {
        "id": "S2",
        "parent_id": "S-TOTAL",
        "title": "事件闭环设计",
        "max_score": 25,
        "node_type": "rollup",
        "aggregation": "sum",
        "rule_text": "事件闭环设计25分：状态设计10分；异常及退回机制8分；权限及日志7分，逐项描述并配流程图。",
        "evidence_requirements": [],
        "sources": [
          {
            "source_id": "SRC-001",
            "revision": 1,
            "sha256": "06e94c48e988157848908ff2e209df8f74a0b38c52cc60fd0331eaa3ff1018b8",
            "location": "body[14]/paragraph",
            "quote": "S2事件闭环设计25分：状态设计10分；异常及退回机制8分；权限及日志7分，逐项描述并配流程图。",
            "kind": "tender"
          }
        ]
      },
      {
        "id": "S2-1",
        "parent_id": "S2",
        "title": "状态设计",
        "max_score": 10,
        "node_type": "scored",
        "aggregation": "none",
        "rule_text": "S2 状态设计10分：须逐项描述并配流程图。",
        "evidence_requirements": [
          "六个状态的逐项描述",
          "状态流转流程图"
        ],
        "sources": [
          {
            "source_id": "SRC-001",
            "revision": 1,
            "sha256": "06e94c48e988157848908ff2e209df8f74a0b38c52cc60fd0331eaa3ff1018b8",
            "location": "body[14]/paragraph",
            "quote": "状态设计10分",
            "kind": "tender"
          }
        ]
      },
      {
        "id": "S2-2",
        "parent_id": "S2",
        "title": "异常及退回机制",
        "max_score": 8,
        "node_type": "scored",
        "aggregation": "none",
        "rule_text": "S2 异常及退回机制8分：对应复核不通过退回处置并保留日志。",
        "evidence_requirements": [
          "退回路径说明",
          "日志保留说明"
        ],
        "sources": [
          {
            "source_id": "SRC-001",
            "revision": 1,
            "sha256": "06e94c48e988157848908ff2e209df8f74a0b38c52cc60fd0331eaa3ff1018b8",
            "location": "body[14]/paragraph",
            "quote": "异常及退回机制8分",
            "kind": "tender"
          }
        ]
      },
      {
        "id": "S2-3",
        "parent_id": "S2",
        "title": "权限及日志",
        "max_score": 7,
        "node_type": "scored",
        "aggregation": "none",
        "rule_text": "S2 权限及日志7分：对应三类角色、最小权限与审计日志要求。",
        "evidence_requirements": [
          "角色与权限矩阵",
          "审计日志设计说明"
        ],
        "sources": [
          {
            "source_id": "SRC-001",
            "revision": 1,
            "sha256": "06e94c48e988157848908ff2e209df8f74a0b38c52cc60fd0331eaa3ff1018b8",
            "location": "body[14]/paragraph",
            "quote": "权限及日志7分",
            "kind": "tender"
          }
        ]
      },
      {
        "id": "S3",
        "parent_id": "S-TOTAL",
        "title": "集成及验收",
        "max_score": 20,
        "node_type": "rollup",
        "aggregation": "sum",
        "rule_text": "S3集成及验收20分：接口映射10分；四类测试及验收证据10分。",
        "evidence_requirements": [],
        "sources": [
          {
            "source_id": "SRC-001",
            "revision": 1,
            "sha256": "06e94c48e988157848908ff2e209df8f74a0b38c52cc60fd0331eaa3ff1018b8",
            "location": "body[15]/paragraph",
            "quote": "S3集成及验收20分：接口映射10分；四类测试及验收证据10分。",
            "kind": "tender"
          }
        ]
      },
      {
        "id": "S3-1",
        "parent_id": "S3",
        "title": "接口映射",
        "max_score": 10,
        "node_type": "scored",
        "aggregation": "none",
        "rule_text": "S3 接口映射10分：对应既有告警平台接入。",
        "evidence_requirements": [
          "接口映射表"
        ],
        "sources": [
          {
            "source_id": "SRC-001",
            "revision": 1,
            "sha256": "06e94c48e988157848908ff2e209df8f74a0b38c52cc60fd0331eaa3ff1018b8",
            "location": "body[15]/paragraph",
            "quote": "接口映射10分",
            "kind": "tender"
          }
        ]
      },
      {
        "id": "S3-2",
        "parent_id": "S3",
        "title": "四类测试及验收证据",
        "max_score": 10,
        "node_type": "scored",
        "aggregation": "none",
        "rule_text": "S3 四类测试及验收证据10分。",
        "evidence_requirements": [
          "测试用例",
          "测试结果"
        ],
        "sources": [
          {
            "source_id": "SRC-001",
            "revision": 1,
            "sha256": "06e94c48e988157848908ff2e209df8f74a0b38c52cc60fd0331eaa3ff1018b8",
            "location": "body[15]/paragraph",
            "quote": "四类测试及验收证据10分",
            "kind": "tender"
          }
        ]
      },
      {
        "id": "S4",
        "parent_id": "S-TOTAL",
        "title": "服务方案",
        "max_score": 15,
        "node_type": "rollup",
        "aggregation": "sum",
        "rule_text": "S4服务方案15分：响应机制8分；人员排班和培训7分。",
        "evidence_requirements": [],
        "sources": [
          {
            "source_id": "SRC-001",
            "revision": 1,
            "sha256": "06e94c48e988157848908ff2e209df8f74a0b38c52cc60fd0331eaa3ff1018b8",
            "location": "body[16]/paragraph",
            "quote": "S4服务方案15分：响应机制8分；人员排班和培训7分。",
            "kind": "tender"
          }
        ]
      },
      {
        "id": "S4-1",
        "parent_id": "S4",
        "title": "响应机制",
        "max_score": 8,
        "node_type": "scored",
        "aggregation": "none",
        "rule_text": "S4 响应机制8分：对应工作日服务与故障响应时限。",
        "evidence_requirements": [
          "响应流程与时限承诺"
        ],
        "sources": [
          {
            "source_id": "SRC-001",
            "revision": 1,
            "sha256": "06e94c48e988157848908ff2e209df8f74a0b38c52cc60fd0331eaa3ff1018b8",
            "location": "body[16]/paragraph",
            "quote": "响应机制8分",
            "kind": "tender"
          }
        ]
      },
      {
        "id": "S4-2",
        "parent_id": "S4",
        "title": "人员排班和培训",
        "max_score": 7,
        "node_type": "scored",
        "aggregation": "none",
        "rule_text": "S4 人员排班和培训7分。",
        "evidence_requirements": [
          "人员排班表",
          "培训计划"
        ],
        "sources": [
          {
            "source_id": "SRC-001",
            "revision": 1,
            "sha256": "06e94c48e988157848908ff2e209df8f74a0b38c52cc60fd0331eaa3ff1018b8",
            "location": "body[16]/paragraph",
            "quote": "人员排班和培训7分",
            "kind": "tender"
          }
        ]
      },
      {
        "id": "S5",
        "parent_id": "S-TOTAL",
        "title": "类似业绩",
        "max_score": 10,
        "node_type": "scored",
        "aggregation": "none",
        "rule_text": "S5类似业绩10分：提供一份软件平台集成合同复印件及验收证明，两者齐备计10分，否则0分。",
        "evidence_requirements": [
          "软件平台集成合同复印件",
          "验收证明"
        ],
        "sources": [
          {
            "source_id": "SRC-001",
            "revision": 1,
            "sha256": "06e94c48e988157848908ff2e209df8f74a0b38c52cc60fd0331eaa3ff1018b8",
            "location": "body[17]/paragraph",
            "quote": "S5类似业绩10分：提供一份软件平台集成合同复印件及验收证明，两者齐备计10分，否则0分",
            "kind": "tender"
          }
        ]
      }
    ],
    "arithmetic_findings": [
      "根项 S1+…+S5 = 30+25+20+15+10 = 100，与声明总分一致。",
      "S2 子项 10+8+7=25；S3 子项 10+10=20；S4 子项 8+7=15，均为简单加和。",
      "S1 为公式计分、S5 为全有或全无计分，未提供报价与业绩材料时无法预估得分。"
    ],
    "unknowns": [
      "未提供本供应商报价，S1 价格分无法计算。",
      "未提供软件平台集成合同复印件及验收证明，S5 无法计分。",
      "S2-S4 为描述与证据型评分，需按评分表逐条对应正文与证明材料，尚未评审。"
    ]
  },
  "warnings": [],
  "blockers": [
    "缺少报价、业绩与人员材料，评分只能核验规则结构，不能核验实际得分。"
  ]
}
